{
  "schema_version": 1,
  "profile_id": "keychron-v3-ansi-encoder-effect25",
  "display_name": "Keychron V3 ANSI Encoder with Abralia effect 25",
  "adapter": {
    "id": "keychron-effect25-rawhid",
    "min_version": 1
  },
  "device_match": {
    "vendor_id": 13364,
    "product_id": 817,
    "usage_page": 65376,
    "usage": 97
  },
  "keymap": {
    "matrix_rows": 6,
    "matrix_columns": 16,
    "encoder_count": 1
  },
  "expected_led_count": 87,
  "interaction": {
    "toggle_matrix": [
      3,
      14
    ]
  },
  "capabilities": {
    "per_key_rgb": true,
    "independent_brightness": true,
    "guarded_frames": true,
    "local_animation": true
  },
  "elements": [
    {
      "id": "ESC",
      "type": "key",
      "row": 0,
      "order": 0,
      "geometry": {
        "x": 0,
        "y": 0,
        "width": 1,
        "height": 1
      },
      "led_address": 0,
      "led_point": {
        "x": 0.0,
        "y": 0.0
      },
      "matrix": [
        0,
        0
      ]
    },
    {
      "id": "F1",
      "type": "key",
      "row": 0,
      "order": 1,
      "geometry": {
        "x": 1.25,
        "y": 0,
        "width": 1,
        "height": 1
      },
      "led_address": 1,
      "led_point": {
        "x": 1.2679,
        "y": 0.0
      },
      "matrix": [
        0,
        1
      ]
    },
    {
      "id": "F2",
      "type": "key",
      "row": 0,
      "order": 2,
      "geometry": {
        "x": 2.25,
        "y": 0,
        "width": 1,
        "height": 1
      },
      "led_address": 2,
      "led_point": {
        "x": 2.298,
        "y": 0.0
      },
      "matrix": [
        0,
        2
      ]
    },
    {
      "id": "F3",
      "type": "key",
      "row": 0,
      "order": 3,
      "geometry": {
        "x": 3.25,
        "y": 0,
        "width": 1,
        "height": 1
      },
      "led_address": 3,
      "led_point": {
        "x": 3.3281,
        "y": 0.0
      },
      "matrix": [
        0,
        3
      ]
    },
    {
      "id": "F4",
      "type": "key",
      "row": 0,
      "order": 4,
      "geometry": {
        "x": 4.25,
        "y": 0,
        "width": 1,
        "height": 1
      },
      "led_address": 4,
      "led_point": {
        "x": 4.3583,
        "y": 0.0
      },
      "matrix": [
        0,
        4
      ]
    },
    {
      "id": "F5",
      "type": "key",
      "row": 0,
      "order": 5,
      "geometry": {
        "x": 5.5,
        "y": 0,
        "width": 1,
        "height": 1
      },
      "led_address": 5,
      "led_point": {
        "x": 5.6261,
        "y": 0.0
      },
      "matrix": [
        0,
        5
      ]
    },
    {
      "id": "F6",
      "type": "key",
      "row": 0,
      "order": 6,
      "geometry": {
        "x": 6.5,
        "y": 0,
        "width": 1,
        "height": 1
      },
      "led_address": 6,
      "led_point": {
        "x": 6.6562,
        "y": 0.0
      },
      "matrix": [
        0,
        6
      ]
    },
    {
      "id": "F7",
      "type": "key",
      "row": 0,
      "order": 7,
      "geometry": {
        "x": 7.5,
        "y": 0,
        "width": 1,
        "height": 1
      },
      "led_address": 7,
      "led_point": {
        "x": 7.6864,
        "y": 0.0
      },
      "matrix": [
        0,
        7
      ]
    },
    {
      "id": "F8",
      "type": "key",
      "row": 0,
      "order": 8,
      "geometry": {
        "x": 8.5,
        "y": 0,
        "width": 1,
        "height": 1
      },
      "led_address": 8,
      "led_point": {
        "x": 8.7165,
        "y": 0.0
      },
      "matrix": [
        0,
        8
      ]
    },
    {
      "id": "F9",
      "type": "key",
      "row": 0,
      "order": 9,
      "geometry": {
        "x": 9.75,
        "y": 0,
        "width": 1,
        "height": 1
      },
      "led_address": 9,
      "led_point": {
        "x": 9.9844,
        "y": 0.0
      },
      "matrix": [
        0,
        9
      ]
    },
    {
      "id": "F10",
      "type": "key",
      "row": 0,
      "order": 10,
      "geometry": {
        "x": 10.75,
        "y": 0,
        "width": 1,
        "height": 1
      },
      "led_address": 10,
      "led_point": {
        "x": 11.0145,
        "y": 0.0
      },
      "matrix": [
        0,
        10
      ]
    },
    {
      "id": "F11",
      "type": "key",
      "row": 0,
      "order": 11,
      "geometry": {
        "x": 11.75,
        "y": 0,
        "width": 1,
        "height": 1
      },
      "led_address": 11,
      "led_point": {
        "x": 12.0446,
        "y": 0.0
      },
      "matrix": [
        0,
        11
      ]
    },
    {
      "id": "F12",
      "type": "key",
      "row": 0,
      "order": 12,
      "geometry": {
        "x": 12.75,
        "y": 0,
        "width": 1,
        "height": 1
      },
      "led_address": 12,
      "led_point": {
        "x": 13.0748,
        "y": 0.0
      },
      "matrix": [
        0,
        12
      ]
    },
    {
      "id": "KNOB_PRESS",
      "type": "key",
      "row": 0,
      "order": 13,
      "geometry": {
        "x": 14,
        "y": 0,
        "width": 1,
        "height": 1
      },
      "led_address": null,
      "led_point": null,
      "matrix": [
        0,
        13
      ]
    },
    {
      "id": "SCREENSHOT",
      "type": "key",
      "row": 0,
      "order": 14,
      "geometry": {
        "x": 15.25,
        "y": 0,
        "width": 1,
        "height": 1
      },
      "led_address": 13,
      "led_point": {
        "x": 15.6897,
        "y": 0.0
      },
      "matrix": [
        0,
        14
      ]
    },
    {
      "id": "SCROLL_LOCK",
      "type": "key",
      "row": 0,
      "order": 15,
      "geometry": {
        "x": 16.25,
        "y": 0,
        "width": 1,
        "height": 1
      },
      "led_address": 14,
      "led_point": {
        "x": 16.7199,
        "y": 0.0
      },
      "matrix": [
        0,
        15
      ]
    },
    {
      "id": "LIGHTING_KEY",
      "type": "key",
      "row": 0,
      "order": 16,
      "geometry": {
        "x": 17.25,
        "y": 0,
        "width": 1,
        "height": 1
      },
      "led_address": 15,
      "led_point": {
        "x": 17.75,
        "y": 0.0
      },
      "matrix": [
        3,
        14
      ]
    },
    {
      "id": "GRAVE",
      "type": "key",
      "row": 1,
      "order": 0,
      "geometry": {
        "x": 0,
        "y": 1.25,
        "width": 1,
        "height": 1
      },
      "led_address": 16,
      "led_point": {
        "x": 0.0,
        "y": 1.2305
      },
      "matrix": [
        1,
        0
      ]
    },
    {
      "id": "1",
      "type": "key",
      "row": 1,
      "order": 1,
      "geometry": {
        "x": 1,
        "y": 1.25,
        "width": 1,
        "height": 1
      },
      "led_address": 17,
      "led_point": {
        "x": 1.0301,
        "y": 1.2305
      },
      "matrix": [
        1,
        1
      ]
    },
    {
      "id": "2",
      "type": "key",
      "row": 1,
      "order": 2,
      "geometry": {
        "x": 2,
        "y": 1.25,
        "width": 1,
        "height": 1
      },
      "led_address": 18,
      "led_point": {
        "x": 2.0603,
        "y": 1.2305
      },
      "matrix": [
        1,
        2
      ]
    },
    {
      "id": "3",
      "type": "key",
      "row": 1,
      "order": 3,
      "geometry": {
        "x": 3,
        "y": 1.25,
        "width": 1,
        "height": 1
      },
      "led_address": 19,
      "led_point": {
        "x": 3.0904,
        "y": 1.2305
      },
      "matrix": [
        1,
        3
      ]
    },
    {
      "id": "4",
      "type": "key",
      "row": 1,
      "order": 4,
      "geometry": {
        "x": 4,
        "y": 1.25,
        "width": 1,
        "height": 1
      },
      "led_address": 20,
      "led_point": {
        "x": 4.1205,
        "y": 1.2305
      },
      "matrix": [
        1,
        4
      ]
    },
    {
      "id": "5",
      "type": "key",
      "row": 1,
      "order": 5,
      "geometry": {
        "x": 5,
        "y": 1.25,
        "width": 1,
        "height": 1
      },
      "led_address": 21,
      "led_point": {
        "x": 5.1507,
        "y": 1.2305
      },
      "matrix": [
        1,
        5
      ]
    },
    {
      "id": "6",
      "type": "key",
      "row": 1,
      "order": 6,
      "geometry": {
        "x": 6,
        "y": 1.25,
        "width": 1,
        "height": 1
      },
      "led_address": 22,
      "led_point": {
        "x": 6.1808,
        "y": 1.2305
      },
      "matrix": [
        1,
        6
      ]
    },
    {
      "id": "7",
      "type": "key",
      "row": 1,
      "order": 7,
      "geometry": {
        "x": 7,
        "y": 1.25,
        "width": 1,
        "height": 1
      },
      "led_address": 23,
      "led_point": {
        "x": 7.2109,
        "y": 1.2305
      },
      "matrix": [
        1,
        7
      ]
    },
    {
      "id": "8",
      "type": "key",
      "row": 1,
      "order": 8,
      "geometry": {
        "x": 8,
        "y": 1.25,
        "width": 1,
        "height": 1
      },
      "led_address": 24,
      "led_point": {
        "x": 8.2411,
        "y": 1.2305
      },
      "matrix": [
        1,
        8
      ]
    },
    {
      "id": "9",
      "type": "key",
      "row": 1,
      "order": 9,
      "geometry": {
        "x": 9,
        "y": 1.25,
        "width": 1,
        "height": 1
      },
      "led_address": 25,
      "led_point": {
        "x": 9.2712,
        "y": 1.2305
      },
      "matrix": [
        1,
        9
      ]
    },
    {
      "id": "0",
      "type": "key",
      "row": 1,
      "order": 10,
      "geometry": {
        "x": 10,
        "y": 1.25,
        "width": 1,
        "height": 1
      },
      "led_address": 26,
      "led_point": {
        "x": 10.3013,
        "y": 1.2305
      },
      "matrix": [
        1,
        10
      ]
    },
    {
      "id": "MINUS",
      "type": "key",